,Title,Upvote_ratio,Score,Gilded,Over_18,Number_of_Comments
0,What's the most f*cked up thing you saw at a sleepover?,0.9,40112,1,True,11626
1,"[Serious] Men of Reddit, what are some questions you have regarding women's anatomy?",0.92,3696,0,False,4944
2,What cinematic death would have had the best oompa loompa song?,0.97,4213,0,False,711
3,What is a NOT fun fact?,0.85,77810,0,False,33082
4,"Apart from accent, how can you tell someone is British?",0.95,6295,0,False,6408
5,What single scene from a movie is an absolute masterpiece?,0.96,1371,0,False,2147
6,What are NSFW fun facts about you?,0.87,469,0,True,966
7,What character is written to be hated/disliked but ended up being your favorite?,0.97,1768,0,False,2235
8,"In the seconds before you die, you are allowed to know everyone who was secretly in love with you at some point. Do you want to know?",0.92,82,0,False,69
9,What was ruined cause too many people started doing it?,0.89,243,0,False,552
10,Why did you join reddit?,0.9,118,0,False,284
11,Men what’s the stupidest way you’ve hurt your nuts?,0.87,137,0,False,441
12,What are some of your anti-consumerism lifehacks?,0.93,399,0,False,354
13,Parents of twins babies. Are you 100% sure you know which twin is which?,0.94,629,0,False,271
14,What do you silently judge people for?,0.88,130,0,False,403
15,What would happen if the balls were on top of the dick instead of below the dick?,0.75,64,0,True,138
16,"What is your favorite YouTube video? Not channel, but the best single video?",0.93,31,0,False,61
17,What’s an underrated Youtube channel you want to share?,0.96,58,0,False,158
18,What kind of old person do you want to be?,0.97,45,0,False,94
19,What’s a compliment you’ve received that didn’t have to do with your appearance?,1.0,29,0,False,44
20,Think back to elementary school. Who was that kid that you still remember even though you haven't been in touch with them since you were young? What made them memorable?,0.93,279,0,False,377
21,What do you consider to be sexy for others but not you?,0.9,45,0,True,108
22,Which minor character are you unreasonably attached to?,0.87,28,0,False,54
23,The year is 2030. The first astronauts have landed on mars. They find a cave with a human skeleton in it and some words written on the wall. What do they say?,0.83,20,0,False,63
24,"People who genuinely see people, listen to them, remember what’s going on in their lives, ask and care how they are, are the shoulder to lean on...How are YOU doing?",0.9,2182,0,False,766
25,"Ex-convicts, what is the worst thing you have ever seen a guard do while in prison?",0.93,13528,0,False,2985
26,What would you do if you won the lottery?,0.96,19,0,False,38
27,Mcdonalds creates a Sad Meal. What are the menu items (and toys)?,0.82,324,0,False,471
28,What do you wish was standard etiquette?,0.9,16,0,False,24
29,If pizza can be called pie then why not call poptarts ravioli?,0.76,33,0,False,69
30,When you eat corn on the cob do you eat cobwise or counter-cobwise?,0.84,66,0,False,52
31,Do any other Europeans check Reddit every morning just to see what happened in the latest episode of last night in America?,0.94,14,0,False,7
32,"What’s the worst present you were ever given, yet had to pretend you liked?",0.93,33,0,False,77
33,What was the last straw that made you quit your job?,0.87,62,0,False,108
34,Who is your favorite superhero and why?,0.8,46,0,False,124
35,"People whose homes smell nice, what's your secret?",0.96,24,0,False,39
36,What age did you start drinking alcohol?,1.0,18,0,False,56
37,What is the most messed up thing you've seen someone do on drugs?,0.91,198,0,True,293
38,Yes sex is cool but have you ever had a friend who would wait for you while you tie your shoes if yes how did you meet them?,0.79,18,0,True,16
39,[serious] when did you realize you dodged a bullet?,0.92,154,0,False,245
40,How often do you see your mom and dad?,0.82,44,0,False,312
41,What is clearly a scam but Americans have been conditioned to believe that it is “normal”?,0.68,47,0,False,272
42,"In your personal hell, what song has Satan chosen for you?",0.9,29,0,False,147
43,What is the 'asbestos' of our generation? What do we use so casually believing to be safe when in a few decades it will turn out to be actually killing us?,0.82,23,0,False,62
44,What is a cool skill you can learn in a day?,1.0,16,0,False,23
45,What's the worst thing that has ever come out of your body?,0.88,39,0,False,103
46,Humans of Reddit: what is the universal sign of “I’m friendly”?,0.84,42,0,False,93
47,How do you tell people “go away I want to be alone” without sounding like an asshole?,0.96,18,0,False,34
48,"You are reborn as a new human being, but still have the memories of your past life. What do you do?",1.0,14,0,False,20
49,"Redditors, what is your favorite candle scent?",0.92,24,0,False,60
50,What song is your anthem?,1.0,16,0,False,31
51,What doesn't count as a personality?,0.88,287,0,False,583
52,A lot of people seem to think it’s anti-Semitic to criticise the actions of Israel. Do you agree? Why or why not?,0.93,13,0,False,34
53,What’s the most fire rap verse you’ve ever heard?,0.79,23,0,False,66
54,"Women of Reddit, what's the weirdest thing a man has wanted from you?",0.83,79,0,True,205
55,"The year is 2121 and every street corner has a ""lipo-barber"", a place where fat can be added or removed from anywhere in the body. What are some of the latest fat-sion tends?",0.79,21,0,False,19
56,What random animal fact should everyone know?,1.0,13,0,False,35
57,What is the worst thing you ever masturbated to?,0.87,17,0,True,32
58,"Straight people of Reddit: if your gay friend came up to you and said ""I know it can never happen between us but I want you to know that I think you are super hot and beautiful"". How would you react?",0.8,12,0,False,34
59,What was the best tasting water you’ve ever had?,0.96,24,0,False,70
60,Which song is impossible to make love to?,0.89,372,0,True,698
61,What's your favorite kind of cake?,1.0,13,0,False,32
62,Why Reddit is better than Facebook ?,0.74,15,0,False,56
63,Non-Americans of Reddit- what is something you thought was made up about America until you saw it for yourself?,0.9,22,0,False,45
64,What is the most awkward situation you've been in at a friends house?,1.0,15,0,False,36
65,"""Shoot for the moon. Even if you miss, you'll land among the stars.” What's a real-life example of this?",0.92,10,0,False,14
66,What do you do if you find condoms in your 17 year old’s room?,0.78,24,0,False,88
67,What single event do you think will cause WWIII if it was to happen?,1.0,20,0,False,66
68,Why do you get out of bed in the morning?,1.0,10,0,False,28
69,What movie traumatized you as a kid?,1.0,9,0,False,33
70,[Serious] How do you properly say to someone that you like them?,0.85,57,0,False,70
71,what are some websites to get lost in?,1.0,10,0,False,20
72,What’s the ultimate 90’s nostalgia?,0.92,20,0,False,55
73,What is one rule you have for yourself that you never break?,0.91,71,0,False,175
74,What is the most inappropriate music to play in the titanic when jack dies in the water and falls off the door?,0.83,67,0,False,176
75,[Serious] What do you think happens after we die?,1.0,8,0,False,22
76,What used to scare you as a child?,0.92,10,0,False,111
77,In what context you are an expert?,1.0,8,0,False,30
78,What is the best flavor of chip known to mankind?,0.87,32,0,False,121
79,How are electric vehicle batteries recycled?,0.81,9,0,True,14
80,what animal do you think has the most fun just living normally?,1.0,13,0,False,26
81,What gets worse the richer you become?,1.0,19,0,False,47
82,What is a Service you really enjoyed that is no longer available?,0.84,34,0,False,112
83,What's the most ridiculous conspiracy theory you have ever heard?,0.94,12,0,False,32
84,Why hasn't anyone tried bringing back Drive In Theaters?,0.91,9,0,False,19
85,What’s a conspiracy theory you believe that most would consider you crazy for believing?,0.93,12,0,False,69
86,Why do you like to be alive?,1.0,8,0,False,19
87,What’s the greatest mental health tip you’ve gotten?,0.97,27,0,False,61
88,"If weed is ""the devil's lettuce"", what are some of the devil's other things?",0.69,20,0,False,75
89,What do you think the aliens are waiting for to make contact with humans?,0.91,9,0,False,39
90,What’s an album or song that really “blew your mind” the first time you heard it?,1.0,17,0,False,51
91,"What would you do if you know, you are going to die tomorrow ?",0.85,9,0,False,19
92,"At what point did you suddenly decide “Fuck this, I didn’t sign up for this, these are not my people, I’m out!”?",1.0,7,0,False,14
93,"What's something that you thought was normal, but is actually really bad?",0.89,29,0,False,35
94,"What's a good US city to travel to for a person looking to hit ""reset"" on their life?",0.89,19,0,False,42
95,When and how did you became aware of Adolf Hitler?,1.0,7,0,False,20
96,Former Flat Earthers. What made you come round?,0.78,100599,4,False,9020
97,How do penguins drink?,1.0,7,0,False,25
98,"If u had a superpower, how would you use it?",0.82,7,0,False,16
99,"If you could try any fictional food, what would it be?",0.89,37,0,False,137
100,Have you ever heard people speaking about you in a different language they assumed you didn't understand? What happened?,0.9,37,0,False,39
101,What are some of the best ways to increase neuroplasticity?,0.9,7,0,False,9
102,"If swear words are bad words, what are some good words?",0.92,9,0,False,23
103,"Hey Reddit, what's better: Cup ramen or Pack ramen?",0.93,13,0,False,57
104,When was the last you jerked off?,0.9,8,0,False,22
105,Why would you say a half a dozen when you could literally just say six ?,0.85,18,0,False,28
106,What video game do you think would make for a great movie/TV show?,0.9,8,0,False,31
107,"Some people don't enjoy music, some people feel nothing for poetry or dance. Is there any media you feel nothing for, which others seem to greatly enjoy?",0.84,8,0,False,25
108,What does love feel like?,0.86,14,0,False,37
109,"students of Reddit, how has covid messed up your education?",0.87,21,0,False,38
110,What is a painfully overrated song?,0.9,17,0,False,77
111,What specifically would you buy if you won the $750 million dollar mega millions jackpot tonight? Feel free to post links?,0.82,27,0,False,94
112,What’s one thing that you absolutely LOVE about yourself?,0.92,10,0,False,29
113,"For 7 Days, Every 1 video game enemy you kill will cause of Cancer patient to defeat cancer by the end of the 7 weeks. Every 1 boss you defeat will cause ten cancer patients to defeat cancer. What game do you play to maximize the effect?",0.74,28,0,False,110
114,[Serious] What made you decide you never want to love again?,0.9,8,0,False,13
115,How did you become so beautiful?,0.88,6,0,False,21
116,"What is something that is seen as a necessity now, but will be seen as obsolete within the next 25 years?",0.92,11,0,False,33
117,What phobia is the worst and why?,1.0,6,0,False,12
118,What do you know/think about Denmark?,0.86,37,0,False,151
119,Need help. What phrase describes a person who stays in a job too long?,0.74,13,0,False,53
120,What's more impressive when it's done naked?,0.83,93,0,True,236
121,How do you make someone stop liking you without rejecting them?,0.95,14,0,False,31
122,What object would be the weirdest to use as a weapon against home invaders?,1.0,6,0,False,29
123,"Women of reddit when did you realize ""I'm a woman now""? Men of reddit when did you realize ""I'm a man now""?",0.87,17,0,False,43
124,If you could hang out with one celebrity for 24 hours. Who would that celebrity be?,0.91,8,0,False,12
125,"People who live in Australia and also have arachnophobia, how you holding up?",0.8,6,0,False,4
126,What are some of your favorite Asian dishes?,1.0,6,0,False,17
127,"What is a phrase, motto, quote, expression or standard that you live by?",1.0,5,0,False,25
128,What would you like to tell the young people?,1.0,5,0,False,14
129,What do you envy the most from the opposite sex?,1.0,5,0,True,19
130,What would be the worst “buy one get one free” sale of all time?,1.0,5,0,False,4
131,when were you “suffering from success”??,0.9,7,0,False,5
132,"If you could wish for anything right now, under a twenty dollar value, what would it be?",1.0,6,0,False,17
133,[serious] How to help SO overcome negative self image?,0.81,6,0,False,11
134,"If the Internet ever came to an end, and end credits similar to a movie's began playing, what would one of the credits songs be?",1.0,5,0,False,8
135,What is the most f*ucked up thing your teacher did in class?,0.86,5,0,False,26
136,How would it change your life if it was dark for 10 years and sunny for 10 years at a time?,0.82,20,0,False,20
137,People who make friends easily: HOW?,0.79,32,0,False,70
138,"Blind Redditors, how do you know when you’ve wiped enough after taking a dump?",1.0,5,0,False,5
139,What is a wrong fun fact about you?,1.0,5,0,False,12
140,What are some good ways to deal with bottled up emotions?,1.0,6,0,False,12
141,What are some things new homeowners should know?,0.99,8,0,False,24
142,What is your dream place to live?,1.0,5,0,False,17
143,Who is your favourite youtuber and what content does he/she make?,0.77,7,0,False,35
144,What was the cruelest thing you’ve ever witnessed humanity do with your own eyes?,0.86,5,0,True,11
145,To Non-Americans: How do you guys view America right now?,0.65,6,0,False,52
146,People who wear socks to bed why?,0.82,7,0,False,20
147,How would you feel if it turned out that the thing that happened the other day was just an orchestrated distraction so that the Declaration of Independence and its secret treasure map would be left unguarded and it could be more easily stolen ?,0.78,5,0,False,5
148,Who owns an iPod Touch?,0.85,9,0,False,47
149,What traumatized you but really isn't that scary?,0.88,13,0,False,36
150,Why are you angry?,0.85,9,0,False,28
151,If an alternate (opposite) universe exists who are you in that universe?,0.92,11,0,False,31
152,What TV quote do you have to say in the character’s voice?,0.82,20,0,False,92
153,What's the darkest shit you've ever seen?,0.88,6,0,False,26
154,What is the RIGHT way to breakup with someone?,0.85,60,0,False,112
155,What is your favorite Jolly Rancher flavor and why is it green apple?,0.58,9,0,False,36
156,What are the best Sci-fi TV shows that are scientifically inclined and accurate?,1.0,6,0,False,19
157,What are the advantages of sleeping naked ?,0.81,10,0,False,22
158,What is the most illegal thing you own?,1.0,7,0,False,19
159,What are your non-sexual fantasies?,0.91,152,0,False,449
160,What foods are totally NOT worth making at home?,0.85,50,0,False,201
161,Do people in other english speaking countries get annoyed when an american says math instead of maths?,1.0,5,0,False,15
162,"What is one line that will immediately get your favorite show, song, singer, actor, movie etc recognized?",1.0,5,0,False,9
163,"[serious] Redditors that believe in a higher power, why?",0.78,5,0,False,15
164,What do you think about being called Daddy in bed?,0.79,8,0,False,39
165,What was the worst you physically felt?,1.0,7,0,False,26
166,You just received the power of invisibility. What do you do first?,0.81,38,0,False,208
167,What is the weirdest inside joke you have with another person?,0.88,6,0,False,15
168,"People who've had their friends open up to them, what did you do?",1.0,5,0,False,5
169,What is the biggest drawback of being born as a human?,1.0,5,0,False,12
170,Who is the most universally liked person in the United States?,0.8,9,0,False,60
171,When do you decide to look at someone’s posts and comments?,1.0,6,0,False,5
172,Time Travelers / Pyschonauts / Sorcerers of Reddit that were stuck in a Time Loop: How did you get out?,1.0,5,0,False,9
173,What’s the most supernatural thing that happened to you?,1.0,5,0,False,7
174,If their was a sport called dick jousting what would it be like?,0.74,7,0,False,11
175,What is one thing you wish people could feel so they could understand you better?,0.9,14,0,False,41
176,"The song you listened to last is broadcasted to the world, what are we jamming to?",0.79,15,0,False,86
177,What’s a artist/band/group that you want recommend to people?,0.88,6,0,False,18
178,What are the worst 2 personality traits for someone to have when combined?,1.0,4,0,False,3
179,What expensive thing did you buy for a kid that they ended up not giving a sh*t about?,0.86,14,0,False,17
180,What popular joke is unfunny to you?,0.88,6,0,False,21
181,"[Serious] Women of Reddit, What are some of the questions you have regarding men’s anatomy?",1.0,4,0,False,14
182,What does a successful relationship look like to you?,1.0,8,0,False,15
183,"What movie did you watch when you were too young, which left you traumatised?",1.0,4,0,False,27
184,What is the most adorable thing a child has ever said to you?,0.93,26,0,False,45
185,What screams “I’ve never been in a trusting relationship”?,0.9,8,0,False,14
186,If you could have any animal that would love you. What animal would you pick?,0.92,9,0,False,19
187,"People that have been complete assholes in the past, but changed recently. How do you cope with the fact that you used to be a bad person?",0.96,23,0,False,32
188,Are you afraid to die? Why or why not?,0.82,16,0,False,64
189,What’s the most fucked up shit you’ve ever seen?,0.76,21,0,True,86
190,What’s a tv show you used to watch in Middle School?,1.0,4,0,False,13
191,What's something that shouldn't be normalized?,0.83,8,0,False,22
192,What are some movie sequels that surpassed its predecessor(s) in nearly every way?,0.78,5,0,False,19
193,What do you do in your spare time?,0.88,6,0,False,17
194,"Are you okay with body hair? If yes, why? If no, why?",1.0,4,0,False,11
195,"People who vaccinated, when did you do it and how are you feeling now?",0.83,4,0,False,18
196,Whats your favourite tv show you will come back to rewach ?,0.86,20,0,False,60
197,[Serious] Which celebrity death hit you the hardest?,0.79,31,0,False,149
198,"[Serious] Women of Reddit, what pain would you say is identical to period cramps?",0.86,5,0,False,9
199,What would you do if you the super power to make anyone full body orgasm by pointing a finger gun at them?,0.74,37,0,True,93
200,"Hey Reddit, What's Something Odd that Relaxes Or Calms You?",1.0,6,0,False,24
201,"What conspiracy theories throughout history, which may at one point have been considered outlandish, have now been proven to be true?",0.95,897,0,False,886
202,Who really needs to shut the fuck up?,0.9,364,0,False,844
203,How often do you eat pizza and how much do you eat in one sitting?,0.83,4,0,False,13
204,"How often the phrase ""fuck my life"" pop into your head? Does it at all?",0.77,11,0,False,30
205,What is the weirdest thing you put inside yourself?,0.83,4,0,True,59
206,"Bilinguals/multilinguals of Reddit, what language do you think in?",1.0,4,0,False,14
207,"Conventionally attractive people of reddit, what is something people misunderstand about being considered attractive?",1.0,5,0,False,27
208,"You wind up in Elizabethan England and have to convince the monarchy that you are a Soc Media influencer from the future, how do you do this?",0.78,5,0,False,7
209,What kind of alcohol that tastes good for people drinking for the first time?,1.0,4,0,False,23
210,What’s the saddest meal you’ve eaten because there was barely any food at your house?,1.0,4,0,False,13
211,Why would you want to have a secret room in your house?,0.86,27,0,False,100
212,What are you afraid of?,1.0,4,0,False,11
213,What’s your weirdest habit?,1.0,6,0,False,30
214,What's the dumbest thing you've seen your neighbors do?,0.86,5,0,False,9
215,"If you were to build a business empire with what you know today, what would you build it with?",1.0,4,0,False,2
216,What is your ugliest feature?,0.86,5,0,False,15
217,What is that one song everyone seems to love but you absolutely hate?,0.86,5,0,False,14
218,What's something you wouldn't recommend from experience?,1.0,5,0,False,9
219,Which country has a culture that focuses on humility?,1.0,4,0,False,1
220,"Which electric guitar is an all round ""good"" guitar for a beginner to buy ?",1.0,5,0,False,14
221,"If you could Dis-Invent one thing, what would it be?",0.86,25,0,False,107
222,"[Serious] What research study would you run, in any field, if funding wasn't a restriction?",1.0,10,0,False,20
223,Which commonly used pizza topping do you not like?,1.0,5,0,False,35
224,"The Simpsons had that episode where Homer had a ""Do it for her"" board with pictures of his baby Maggie. What's your ""Do it for her"" moment or thing?",0.88,16,0,False,12
225,What has gotten easier as you've gotten older?,1.0,4,0,False,14
226,"People who are currently struggling to fall asleep, what are you thinking about?",0.9,8,0,False,25
227,How did you know that you S/O was the one?,0.91,8,0,False,9
228,How would one get into cryptocurrency?,1.0,4,0,False,8
229,"You have to live in one weather condition for the rest of your life, what would you pick?",1.0,4,0,False,14
230,"Voyager is a space probe exploring deep space. It has a golden record that contains the ""story"" of humanity. From maths, science, images, humans, and much more. You are now tasked to create another golden disc that would be flown on the next Voyager space probe. What would you put in the disc?",1.0,4,0,False,5
231,When and what was the lowest point in your life?,0.86,5,0,False,25
232,"Have you ever gotten a weird feeling while watching/listening to something, and replayed it over-and-over to try and get that feeling again? If so, what was it?",1.0,6,0,False,3
233,"[Serious] Shop owners of Reddit, what is your daily routine like?",1.0,6,0,False,6
234,What’s your favorite mini series? Why?,1.0,5,0,False,8
235,What is the creepiest urban legend you have heard?,0.91,19,0,False,33
236,What minor thing ruins your whole day?,0.78,5,0,False,10
237,What sequel are you still waiting to be announced?,1.0,9,0,False,42
238,So.... how’s 2021 going so far?,1.0,4,0,False,10
239,What song lyric tugs your heartstrings?,1.0,9,0,False,22
240,"[Serious] People from outside the US, what's going on in your country?",0.92,66,0,False,116
241,What would happen if your reddit post about someone recognized you?,0.83,4,0,False,11
242,What ruined your birthday party?,0.83,4,0,False,19
243,What would you do with $2 billion?,1.0,4,0,False,16
244,What's the reason you have no hope for humans anymore?,1.0,5,0,False,18
245,What’s the best thing you’ve bought for under $100?,1.0,6,0,False,16
246,"People of Reddit; Why in bloody hell, does Makarov know you?",0.64,6,0,True,7
247,Your username is the name of a company. What do they sell?,0.86,18,0,False,119
248,"Fathers of reddit whose kid told another kid during an argument ""Well, my dad can beat up your dad!"", How was the fight?",1.0,10,0,False,7
249,"People who don't wash their hands after using the bathroom, why?",0.75,4,0,False,17
250,What's you favorite cure for a hangover?,0.8,16,0,False,60
251,"What's a word that conveys a ""large gathering""?",0.86,5,0,False,17
252,"Redditors, how tall are you?",0.75,6,0,False,59
253,How was your first kiss?,0.89,7,0,False,46
254,"Security guards who have worked at a mental hospital, was there ever a patient who escaped? If so, what happened?",0.86,5,0,False,6
255,"How do you get out of the “F everything, I’m done” mindset?",0.86,5,0,False,9
256,What is your biggest weird guilty pleasure food combination?,1.0,7,0,False,62
257,Would you raise your children the same way you were raised? Why or why not?,0.86,10,0,False,41
258,What is the worst video game you've ever played?,0.83,4,0,False,17
259,What accidental action in a video game made you feel the worst afterwards?,1.0,5,0,False,14
260,"Introverts with anxiety, what should someone who is very extroverted do and not do when talking to you for the first time?",0.87,109,0,False,136
261,Whats the stupidest thing you've ever spent your money on?,1.0,5,0,False,22
262,You’re in a 4 carriage train going 100mph. The drivers area is locked and inaccessible. In thirty seconds the train will collide with another train stopped at a station. How do you improve your chance of surviving?,1.0,5,0,False,17
263,"Come on Reddit, let’s write a song! Title: “Are you ok?”...What is the first lyric?",0.77,21,0,False,59
264,What's the best poem inspired by Chemistry?,1.0,7,0,False,4
265,What's the most ridiculous thing you've heard asked of a child?,0.92,9,0,False,25
266,What’s the biggest work scandal that you’ve witnessed?,1.0,5,0,False,8
267,What song have you had stuck in your head lately? Is it one of those supper annoying yet catchy ones?,1.0,6,0,False,21
268,"Atheists of reddit, what gives you an almost spiritual sense of awe?",0.86,5,0,False,15
269,If you could choose any historical figure dead or alive to spend lockdown with. Who would it be and why?,1.0,4,0,False,18
270,Who is your goto person?,1.0,4,0,False,3
271,Tell us where you’re from without telling us where you’re from?,0.88,18,0,False,135
272,What's the wierdest thing you've brought home after a night out?,1.0,4,0,False,13
273,"If abusing alcohol was the only way you could feel joy, how did you quit?",0.74,7,0,False,20
274,[Serious] What made you disown your own parents?,1.0,4,0,False,6
275,What’s the best piece of advice you’ve ever been given?,1.0,4,0,False,5
276,"If you started a cult, what would it be?",1.0,4,0,False,15
277,"If you could have any animal as a pet, what would it be and why?",0.9,14,0,False,64
278,"[Serious] Women of Reddit, what are some questions you have regarding men's anatomy?",0.83,4,0,False,3
