,Title,Upvote_ratio,Score,Gilded,Over_18,Number_of_Comments
279,"What is something that makes you think ""why would anyone in the right mind spend money on this""?",1.0,9,0,False,37
280,What would happen if California seceded from the USA?,0.83,4,0,False,14
281,"A self driving car runs over someone, there is an adult in the drivers seat. Who is at fault?",0.71,7,0,False,19
282,"If you were to design the first ever toilet, how would it look like?",0.89,7,0,False,15
283,[Serious] How do you have a calm debate with someone without emotions getting in the way?,1.0,4,0,False,13
284,When did you realize that you weren't immune to being fooled by misinformation online?,0.78,5,0,False,8
285,What is a stick?,0.83,4,0,False,7
286,Redditors of age 30+ what is some advice you would give to your 21yo self?,0.87,6,0,False,21
287,"You don’t like how the interviewer is looking at you, what do you say to weird them the fuck out?",1.0,8,0,False,10
288,People whose parents were sex workers or strippers how did you find out and did you care?,0.82,7,0,True,5
289,"So if clapping is just hitting yourself, which hand is hitting the other hand?",0.64,7,0,False,25
290,How do you guys get over hard times in life?,1.0,6,0,False,22
291,"If you faked your death, how would you crash your own funeral?",0.95,456,0,False,460
292,What is something non-edible that you would love to try if it were edible?,0.9,14,0,False,59
293,"Doctors of reddit, how are comatose patients autonomous bodily functions (as in urination, menstruation, saliva production, etc) dealt with?",0.83,4,0,True,5
294,What was the dumbest way you hurt yourself?,0.76,11,0,True,183
295,What movie title describes your sex life?,0.73,12,0,True,64
296,What crime would you commit if you absolutely knew you would get away with it?,0.83,12,0,False,43
297,When is it better to NOT do the right thing?,0.72,3,0,False,14
298,If you had the power to make someone have a massive crap in an instant what would you do with it?,0.81,9,0,False,27
299,What do you think will happen on the 20th?,0.91,8,0,False,21
300,What is the most stressful time in life?,0.82,12,0,False,20
301,How do you jazz up your mac'n'cheese?,0.76,8,0,False,52
302,"Latinos/Latin Americans, how/wht did Americans get the term “gringo” in Latin America?",0.67,3,0,False,9
303,What advice would you write on a lighter with wisdom?,0.84,4,0,False,7
304,"What's something you really enjoy doing, but rarely have time for?",1.0,4,0,False,10
305,"People, who was your worst classmate ever in school?",0.81,3,0,False,23
306,"Accountants, what's a significant yet easily neglected mistake made in accounting by new businesses/startups?",0.81,3,0,False,9
307,What is something that you would actually never wish on your worst enemy?,1.0,5,0,False,9
308,"What's your most favorite song, from your least favorite genre?",1.0,4,0,False,6
309,"people who have been in jail, what is the worst thing you saw or experienced in that place?",1.0,5,0,False,3
310,When has trusting a gut feeling saved you?,0.89,7,0,False,5
311,What is the saddest event in history that didn't involve death?,1.0,3,0,False,10
312,What's the weirdest subreddit you've ever came across?,0.95,18,0,True,34
313,"If you could live in one video game world forever, what game would you chose?",1.0,3,0,False,9
314,What movie traumatized you as a kid?,1.0,5,0,False,26
315,What was your first experience on the internet?,1.0,3,0,False,6
316,What video game or video game series has the best soundtrack?,0.88,6,0,False,66
317,"Who was a person you looked up to, only to find out that they were an awful being?",1.0,3,0,False,5
318,Showgirls - What the actual FUCK is up with the sex scene in Showgirls?,0.87,6,0,True,9
319,Whats your opinion of how people will act after covid?,1.0,5,0,False,12
320,"Martin Luther King Jr. said ""We all too often have socialism for the rich and rugged free market capitalism for the poor"". What are some examples of this?",0.85,57,0,False,30
321,"What is something that is considered normal, but is actually scary when you think about it?",1.0,4,0,False,10
322,"You wake up in the middle of your city, but it’s abandoned. What do you do?",1.0,4,0,False,26
323,What was the best day of your life and what did you do?,1.0,3,0,False,1
324,Are there people here who had to give up their own dreams and ambitions at a young age to take care of ill/old/underage relatives? How did life treat you?,1.0,4,0,False,1
325,Who are you vs who is the voice in your head when you have internal thoughts?,0.88,6,0,False,14
326,What is the best way to quit a job?,1.0,3,0,False,10
327,What is the most interesting moral issue of our time?,1.0,4,0,False,8
328,What are some reassuring facts?,1.0,3,0,False,9
329,"Theoretically, Mars has one type of currency. What is it called?",0.82,10,0,False,29
330,"Linguists of Reddit, how difficult is it to make a new language?",1.0,11,0,False,2
331,What kind of a women should be there in your life ?,1.0,5,0,False,11
332,What's the dumbest thought you've had today?,0.88,39,0,False,81
333,What’s the reason for pain in life?,1.0,4,0,False,14
334,What is the closest you have came to death?,0.8,3,0,False,7
335,What is the one thing you do not want to see when a barber is cutting your hair?,1.0,3,0,False,12
336,What can we do to kill off a particular bad ideology for good when education and debates failed?,0.75,4,0,False,22
337,If the US raised min wage to $15/hr what keeps companies and landlords from raising their prices/rents?,0.72,3,0,False,56
338,"Has anyone ever eloped, movie style? As in ditching a huge wedding that has both families heavily involved because of constant bickering. If so, what’s your story?",0.8,3,0,False,0
339,What are your opinions on water as a beverage?,0.8,9,0,False,25
340,Have you ever loved someone who doesn't love themself?,0.8,3,0,False,11
341,"Redditors who do not put cream in their coffee but put sugar in it, what are your official NFL playoff predictions?",1.0,5,0,False,5
342,How often do you daydream? And what do you daydream about?,0.84,4,0,False,13
343,"People of Reddit, when did you decide that your best friend wasn’t worth being friends with?",1.0,4,0,False,12
344,What are some books that every book lover should read/own?,0.84,4,0,False,23
345,"What represented the all time peak of your personal gaming existence, ie. best game you were most invested in?",1.0,5,0,False,24
346,"The year is 2069, it is nice, what are you up to?",0.67,8,0,False,51
347,What is your dream job?,0.91,62,0,False,450
348,What would you do with your last 20 minutes onboard the Titanic before it sank?,0.86,5,0,False,17
349,These last 12 months have been almost surreal to live through. What was the strangest or craziest thing you experienced in witnessed in 2020?,0.83,4,0,False,14
350,What's your best advice for a new home owner?,1.0,3,0,False,3
351,"Dear City Folk, what’s it like living in the city?",0.84,4,0,False,3
352,"What song in the world, every time you hear it, gets firmly stuck in your head for days?",0.86,5,0,False,23
353,"If you believe God is Good and Merciful, then how do you explain the existence of the 1-877-Kars 4 Kids commercial ?",0.69,5,0,False,13
354,What’s your favorite store bought cookies?,1.0,11,0,False,35
355,What’s the most you’ve lent/loaned someone that they never/haven’t paid back?,1.0,5,0,False,10
356,What is you horror pet(s) story?,1.0,4,0,False,5
357,How do you get past old and somewhat unpleasant memories?,0.81,3,0,False,11
358,"Which one do you prefer, Ketchup or Mayo?",0.75,4,0,False,22
359,What's a good hitchhikers guide to the galaxy themed present for a guys 42nd birthday?,0.86,5,0,False,16
360,If there was a time machine that let you go back in time to only observe the past and not interact what would you check out?,1.0,6,0,False,9
361,"If you were to kidnap your favorite fictional character, what would you write on the side of your van to lure them in?",0.93,12,0,True,87
362,What is the first album you ever bought?,0.87,12,0,False,47
363,"For those of you who assume the gender of Redditors, what are some things which make you assume a particular gender?",1.0,7,0,False,14
364,Where and when was your worst farting experience?,0.8,3,0,False,7
365,How can Reddit strangers help you to achieve your goals and dreams ?,0.78,5,0,False,10
366,What was it like at your first job?,1.0,3,0,False,2
367,"Women of reddit, how would your fashion sense change in a world without shoes or makeup?",0.83,4,0,False,14
368,What are some worst diseases someone can have?,0.83,4,0,False,20
369,"As a teenager, what was your awkward cringe phase?",1.0,18,0,False,29
370,"Right down to the specifics of it, what is your favorite soda drink?",1.0,7,0,False,25
371,What is the title of an Anime that made you cry?,0.81,6,0,False,30
372,"What did you do that made you stop and say, ""Oh no. I've become my mom/dad""?",0.72,3,0,False,8
373,What book do you think should be made into a movie?,0.83,4,0,False,15
374,What would be a regrettable tattoo to get and where?,1.0,6,0,False,15
375,What was a trend in your fandom that wasn’t a trend anywhere else?,0.72,3,0,False,2
376,What is your favorite quote and how has it affected your life?,0.8,6,0,False,17
377,What would you do if you found out your 10 year old was actually swapped out at birth and the kid you have been raising for 10 years belongs to some other family?,0.91,8,0,False,12
378,What's a skill you have that impresses everyone you show but is super easy to do?,0.67,3,0,False,13
379,"Men of Reddit, how annoying are morning woods and how do you get used to them?",0.84,4,0,False,10
380,What was the best handshake you've ever seen?,1.0,3,0,False,3
381,What's your go to plan when a sex scene comes on with your parents in the room?,0.83,11,0,True,21
382,What is the biggest scam you ever pulled off?,0.84,4,0,False,8
383,When did you realize your relationship was dead?,0.83,4,0,False,33
384,What are some strange or supernatural experiences that you have experienced?,0.99,7,0,False,11
385,Where are you guys from?,0.88,7,0,False,31
386,What was one of the best things ever invented and why?,1.0,7,0,False,13
387,"What is something/someone famous from the internet that you used to like, that you now feel has over stayed its welcome?",1.0,4,0,False,2
388,"Reddit, what is the worst gift you've ever received?",0.86,5,0,False,14
389,"Big breasts or small breasts, what do you like about them?",0.64,8,0,True,51
390,What are some subreddits?,1.0,3,0,False,8
391,What’s your earliest memory as a kid now that you’re an adult?,0.84,4,0,False,9
392,What’s one rule that all gamers respect?,1.0,3,0,False,12
393,whats your favorite movie alien?,1.0,4,0,False,10
394,What is the most insignificant thing you hate?,1.0,7,0,False,18
395,What is one invention you could realistically make yourself and profit off of if you were teleported back to the year 1900?,0.9,8,0,False,12
396,Have you ever wanted to go into a public place and call out a random name and see who answers?,0.9,8,0,False,9
397,When did a police officer “bend” the rules for you?,0.81,9,0,False,43
398,What is the weirdest thing a neighbour has asked from you?,1.0,7,0,False,30
399,What animal are you weirdly obsessed with and why?,1.0,8,0,False,28
400,What gender are you and do you believe in “being just friends” ?,0.6,2,0,False,28
401,What myth from MythBusters were you unsatisfied with on the results and could use more experimenting?,0.88,6,0,False,13
402,"You are talking with your male friend when he says ""if I'm in a relationship, I want to be in charge. That means I'm on top during sex, I'm in charge of the finances, I pay for all the meals, I'm player one in video games, stuff like that."" What would you say to your friend?",0.68,14,0,True,74
403,"Helen Mirren's advice to her younger self would have been to tell more people to ""fuck off"". When was a time you should have said fuck off to someone, but didn't?",0.67,3,0,False,2
404,What’s the grossest thing you ever ate while trying to be polite at someone’s table?,1.0,11,0,False,29
405,What do you rather buy in-person instead of online?,1.0,3,0,False,15
406,What/Who was a Youtuber/Channel you used to love but no longer enjoy them?,1.0,3,0,False,37
407,"Redditors, how did getting Reddit alter your life perceptions?",0.8,3,0,False,4
408,"People who actually fled from war zones, how do you find watching the movies about it made by the west?",0.89,95,0,False,28
409,What is your struggle story that nobody seems to care about but is actually impressive ?,0.83,4,0,False,13
410,"Council wants to change the name of our street because it sounds bad. What will it cost us, residents?",1.0,3,0,False,4
411,"What's the most ""Well, no shit!"" Scientific study conclusion that you've ever seen?",0.94,15660,0,False,3523
412,What if God was one of us?,0.71,3,0,False,23
413,"Dear people of Reddit, what did you last eat?",0.87,11,0,False,86
414,"If you are an alien from an advanced civilisation, how do you want your spaceship to look like?",0.8,3,0,False,7
415,Which word's spelling pisses you off the most?,0.88,24,0,False,113
416,What is the difference between living and existing? ... And what do you consider yourself to be doing right now?,0.88,6,0,False,23
417,"What's your worst ""shouldn't have said that""?",0.87,39,0,False,79
418,"Men of Reddit, what’re you going to do about your boner?",0.63,5,0,True,63
419,What’s is the backstory of any of your grandparents?,0.83,4,0,False,17
420,"People who married their high school sweet hearts, How did the relationship last so long?",0.83,4,0,False,2
421,When do you feel most like your authentic self?,0.92,9,0,False,23
422,What was worst thing that you got away with?,1.0,5,0,False,2
423,What is the most terrifying incident that you’ll never forget?,0.9,8,0,False,10
424,"Fellow Redditors, what is the nicest thing you’ve ever done for a complete stranger, purely out of the kindness of your heart?",1.0,11,0,False,22
425,For those who are insecure about their appearance before. What makes you change and happy with your appearance now?,1.0,6,0,False,20
426,"People of Gen Z, are you old enough to remember what Chuck Norris jokes were?",0.79,23,0,False,25
427,What do you think is the perfect age to have kids and why?,1.0,7,0,False,12
428,What did your Worst Houseguest Ever do to earn that title?,0.81,10,0,False,18
429,"If you could smell like something in particular, what would it be and why?",0.86,5,0,False,8
430,"[Serious] Healthcare workers of Reddit, what are some of the creepiest/unexplainable things that have happened to you while on shift?",0.75,4,0,False,5
431,What water temperature do you prefer to shower with and why?,0.92,10,0,False,26
432,If you could make/remove/change one law. What law would you make/remove/change?,0.75,4,0,False,13
433,What were some seemingly outrageous conspiracy theories that have actually been proven to be true?,1.0,3,0,False,9
434,When does hell break loose?,1.0,6,0,False,14
435,In what type of shop/place would it be weird if someone walked in and said they were ‘just browsing’?,0.89,13,0,False,36
436,What is a series of unfortunate events that happened in your life?,0.72,3,0,False,7
437,When did someone take truth or dare too far?,0.72,3,0,False,4
438,"For those of you that do Psychedelics, explain what happened and your thoughts when you experienced ego death and or loss of self?",1.0,4,0,False,4
439,[Serious] What would you want your last words to be?,1.0,6,0,False,18
440,"How is the Reddit version of you different from the ""real"" you?",1.0,3,0,False,15
441,"For those who were old enough to understand, what was living through 9/11/2001 like?",0.86,5,0,False,29
442,why are you awkward?,0.88,6,0,False,66
443,"who was your worst teacher in school, and why were they so bad?",1.0,3,0,False,10
444,What was the last dream you remember about?,0.8,3,0,False,13
445,What's your famous quote that you came up with?,0.8,6,0,False,15
446,What would you do if your favorite actor knocked on your door and said he's gonna stay for a few weeks?,0.92,19,0,False,31
447,What are some good weird questions to ask people to get to know them better?,1.0,3,0,False,18
448,What song will you NEVER get sick off?,0.9,8,0,False,45
449,What pop culture fact totally blew your mind the first time you heard it?,0.81,3,0,False,3
450,What is a weird experience you’ve had in a foreign place?,0.8,3,0,False,10
451,Hey when does the psychedelic trip stop? Or has everyone look like these talking monkeys?,0.8,3,0,False,6
452,What would you say is the difference between a picky person vs an indecisive person?,1.0,4,0,False,6
453,What is a weird experience you’ve had in a foreign place?,1.0,3,0,False,2
454,Everyone owns at least one cool shiny thing. What's yours?,0.81,6,0,False,37
455,What's the dumbest thing that you have ever fought for?,1.0,3,0,False,17
456,Is it dumb to expect your friends to ask to hang out with you when you’re the one always asking them?,1.0,6,0,False,6
457,Who was a best father figure in any and all television shows?,1.0,3,0,False,15
458,"For those of you who quit drinking soda, what are the pros and cons?",0.83,12,0,False,43
459,What is the drunkest you’ve ever been in your life?,0.82,7,0,False,29
460,"What sounds like a Dr. Phil quote, but is not actually a Dr. Phil quote?",0.92,11,0,False,11
461,What’s your pet peeve about people since lockdowns and COVID?,0.84,4,0,False,27
462,What is the most endearing thing about humans?,1.0,3,0,False,4
463,What is your advice for innocent gay virgins to find a safe and gentle dick?,0.78,5,0,True,6
464,What are your thoughts on aliens?,1.0,10,0,False,24
465,What breed of dog looks the most like a puppy as an adult?,1.0,8,0,False,13
466,What would be in Fifty Shades of Blue?,1.0,3,0,False,10
467,What song do you absolute hate that everyone else loves?,1.0,5,0,False,17
468,when is the best time to remove the Christmas tree?,0.88,13,0,False,30
469,If you could make any business and it would be very successful. What business would you make?,0.88,6,0,False,15
470,What you wish you had done when you were younger?,1.0,3,0,False,11
471,What's your comfort movie?,0.82,15,0,False,57
472,What is your biggest irrational fear?,1.0,11,0,False,19
473,What is one thing that you really like about your ex?,0.81,3,0,False,22
474,"People who remind the teacher about the homework, why?",1.0,3,0,False,15
475,"Christian of Reddit, what makes sex before marriage a sin?",1.0,3,0,True,54
476,How do you feel about fast internet being a basic human right?,0.61,4,0,False,23
477,"Redditors of Reddit, how many hours do you give yourself time in the morning after waking up from sleeping at night do you give yourself before you fulfill the days obligation?",0.67,2,0,False,6
478,You're on a strict diet and the boss announces he's buying pizza for the office. What kind of toppings do you have?,1.0,3,0,False,13
479,What country would you never visit and why?,0.89,112,0,False,472
480,What can you do as a legal adult that you could not as a minor?,0.75,4,0,False,10
481,"What is the best cake piece, why is that your reasoning?",1.0,4,0,False,7
482,What are some of the scariest diseases in history?,0.84,4,0,False,26
483,What does it feel like being you?,1.0,3,0,False,21
484,"Redditors with face tattoos, but are NOT tattoo artists, what do you do for a living?",0.81,6,0,False,15
485,"With all of the negative headlines dominating the news these days, it can be difficult to spot signs of progress. What makes you optimistic about the future?",0.81,3,0,False,6
486,What’s the first thing you dry off when u get out the shower?,0.88,6,0,False,18
487,People who work in Cyber Security: what does a day in your professional life look like?,1.0,3,0,False,1
488,"If you were an dad, how would you name your child?",1.0,4,0,False,21
489,What are your favorite ways to get your hits of dopamine?,0.78,8,0,False,20
490,"People who have an inner monologue, what are some of the unlikely scenarios you put yourself in?",1.0,3,0,False,10
491,Why do you believe you don't deserve happiness?,1.0,3,0,False,11
492,You get to make up your own religion. What are some sins that will send you straight to hell?,0.85,43,0,False,122
493,What are two positive things that can't coexist?,1.0,6,0,False,15
494,"Men of reddit, what its like to have a boner, and how do you hide one?",0.75,4,0,False,20
495,"If you were to go back in time and prevent the death of only one famous person, who would it be and why?",0.81,3,0,False,20
496,Is Dr. Dre just like a clock when he ticks and he tocks?,0.86,5,0,False,7
497,What are some good public speaking tips for doing a speech virtually?,0.85,9,0,False,13
498,What is your way of responding when someone that you don't know knocks on your door?,1.0,5,0,False,15
499,What are some common behaviors that piss you off?,0.89,15,0,False,47
500,What are the worst acts of cheating you’ve witnessed in a relationship ?,0.71,3,0,False,5
501,What’s a hobby/habit that your friend or significant other has that is only charming because they do it?,1.0,4,0,False,2
502,What are your feelings about your father?,0.91,130,0,False,387
503,If you could swap one of your body parts with an animal part what would it be and why?,0.83,4,0,False,12
504,What is your personal line between forgivable and unforgivable crimes?,1.0,3,0,False,5
505,[Serious] What is the nicest thing a random stranger has ever done for you?,1.0,4,0,False,16
506,How has COVID-19 affected war and conflict globally?,1.0,7,0,False,4
507,What lines from a song would be horrible in a book?,1.0,3,0,False,5
508,Which fast food place is the best one and why?,0.89,7,0,False,19
509,What was the biggest goof you ever made?,1.0,3,0,False,4
510,"[Serious] People of Reddit who have taken a life, did you consider yourself capable of doing so beforehand?",1.0,8,0,False,6
511,What IS a fun fact?,0.8,17,0,False,44
512,Which little thing someone did for you will you remember your whole life?,1.0,3,0,False,2
513,What was your earliest memory?,1.0,3,0,False,6
514,What is the most stupid thing you have done or said / or have heard from other / or seen others do a stupid thing?,0.91,8,0,False,8
515,What was your best (or worst) shower thought?,0.82,21,0,False,47
516,[serious] what’s the best move for when you just need to have a big cry?,1.0,6,0,False,20
517,What fictional character do you love the most?,1.0,5,0,False,14
518,What are the most offensive swearwords in your native language??,0.88,6,0,False,21
519,Where do you draw the line?,0.8,3,0,False,10
520,"What is one core value you will always, always keep with you no matter what, and why is it important to you?",1.0,3,0,False,8
521,What was the last song you were skankin’ to?,0.86,5,0,False,16
522,"Like Paul McCartney's first Hofner bass that was stolen in 1969, what are some of the rarest and most sought after artifacts that are still missing after theft?",0.8,9,0,False,7
523,Corona zombies are coming. The warehouse you’re in contains all the famous vehicles from Hollywood....What’s your escape ride?,0.84,9,0,False,49
524,"What non-trivial thing in life have you ended up saying “Wow, I was really wrong about that”?",1.0,3,0,False,1
525,How do we know Franklin the turtle was black?,0.77,5,0,False,12
526,"If you had the ability to choose to magnify only 1 of your 5 senses, which one would you choose?",0.87,12,0,False,18
527,"What is your ""...and I live to this day to tell the story"" scar?",1.0,4,0,False,4
528,"If you won 282 million dollars (post-tax), but wanted to keep it secret, and keep living normally, what would you do with the money other than investing or saving?",0.91,8,0,False,19
529,What’s the ONE THING you remember about 2020 from before COVID changed the world?,1.0,3,0,False,18
530,What has been the leading cause of death in the United States since the United States became a country?,1.0,7,0,False,37
531,What was you scariest moment during high school?,1.0,3,0,False,11
532,"Hey Reddit, what is some fresh good advice that you received lately?",0.85,8,0,False,7
533,"If you were able to cure one disease, which one would you choose and why?",0.86,28,0,False,75
534,"Men of reddit, how would you feel about having your fingers sucked on?",0.74,11,0,False,34
535,"If you were a font, which would you be?",0.86,5,0,False,25
536,People who wear masks while driving alone in your car. Why?,0.6,6,0,False,55
537,How long is it?,1.0,4,0,False,23
538,What was the moment that you say “I really need to lose weight”?,0.92,11,0,False,23
539,Why were you sent to the principals office?,0.75,4,0,True,37
540,Why do you like to be alive?,0.91,9,0,False,19
541,What game brought you a phobia?,1.0,3,0,False,9
542,"While casual sex is fun for everyone, what are your tips for those trying to make it in the competitive scene?",0.73,5,0,True,32
543,what turns you off?,0.84,9,0,False,23
544,You arrive at the job interview and notice a black couch and a camera on the tripod. What's your next move?,0.74,7,0,False,28
545,What are you drinking right now?,1.0,10,0,False,27
546,What character from a TV show/movie do you like but would probably hate if you knew them in real life?,0.9,7,0,False,15
547,What is a video that can always put a smile on your face?,1.0,10,0,False,16
548,What are some problems you want to have?,1.0,5,0,False,14
549,What apps have y’all purchased that are worth having?,0.67,2,0,False,13
550,"[Serious] What is something you're addicted to, but no one takes seriously?",0.75,4,0,False,3
551,How does one stop using Reddit?,0.67,2,0,False,11
552,What is something you did when you were a kid and still embarrassed to this day?,0.91,19,0,False,11
553,"Who were you, who are you, and who will you be?",1.0,5,0,False,15
