,Title,Upvote_ratio,Score,Gilded,Over_18,Number_of_Comments
554,What is an highly rated trash movie ?,1.0,3,0,False,13
555,"If you had a million chickens, what would you do?",1.0,3,0,False,17
556,Why do you have trust issues?,1.0,3,0,False,9
557,What childhood things did your parents say that you later came to realise were totally wrong?,1.0,3,0,False,12
558,What is your best/craziest lucid dream?,1.0,3,0,False,5
559,When you die you get a full statistics list of your life. What are some of your top stats?,0.86,10,0,False,18
560,Who do you think killed Jonbenet Ramsey?,0.7,4,0,False,22
561,Who is your musician crush?,0.88,24,0,False,85
562,Are porch lights an older generation thing? What is the purpose of having them on EVERY night?,0.77,12,0,False,25
563,Who's the most total piece of shit still alive?,0.82,7,0,False,30
564,What are some things that instantly kill your social battery?,1.0,3,0,False,14
565,"People with siblings of reddit, what was the most obvious case of blatant favoritism?",1.0,5,0,False,6
566,"People of reddit, how do you help someone with depression?",1.0,3,0,False,13
567,[Serious] What’s the most fucked up thing you’ve seen on the streets?,1.0,5,0,False,9
568,What cheap habits do rich people have?,0.63,2,0,False,11
569,whats a plot hole in a movie so deep it baffles you on how the film makers missed it?,0.67,2,0,False,2
570,"A witch curses you back in time into a major disaster, but let's you choose which one. With only your knowledge to work with, what's your plan to survive?",0.78,5,0,False,19
571,What’s something you swore you’d never do but did that ended up being one of the best decisions of your life?,0.8,3,0,False,15
572,Who would you die for?,1.0,8,0,False,25
573,what is something life-saving that people should know about?,1.0,6,0,False,10
574,"Picky eaters, what are the things you can’t stand that seem completely normal to everyone else?",0.8,3,0,False,22
575,What movie would have been better if the villain had won?,1.0,8,0,False,18
576,"Parents of highly successful kids, do you ever get jealous of how far life has taken them so far?",0.72,3,0,False,8
577,(Serious) Why do you think you know what another country is like if you’ve never been there?,1.0,4,0,False,18
578,[Serious] What made you smile today?,0.96,17,0,False,45
579,If you were on your deathbed right now what would be your last wish? [Serious],0.86,5,0,False,10
580,What did you learn from your first relationship?,0.67,2,0,False,12
581,What do you do to calm anxiety?,0.72,3,0,False,20
582,What is your favorite Mandela effect?,0.75,4,0,False,12
583,Redditors who have woken up during surgery: what was your experience?,0.87,6,0,False,7
584,"Clothe designers on reddit, why do womens clothes rarely have pockets?",1.0,3,0,False,18
585,"People who were diagnosed with terminal illness, how did you take it?",1.0,3,0,False,1
586,"How would you trick a vegan vampire, which really doesn't want to bite you, into biting you nevertheless?",1.0,2,0,False,1
587,"People who used to be extremely religious but stopped, why?",0.78,5,0,False,28
588,"Reddit, what is your irl “people of Walmart” experience?",0.81,3,0,False,11
589,"People of Reddit, what's your ""Shit I fucked up"" story?",1.0,3,0,False,3
590,what's your go to subreddit?,0.81,3,0,False,9
591,What's your dream Valentine's day like?,1.0,2,0,False,0
592,What did you do with your first ever paycheck?,0.87,16,0,False,60
593,What would be the hardest thing to do without gravity?,0.88,6,0,False,39
594,What was one of the stupidest moments in your childhood?,1.0,3,0,False,3
595,What are some of the good and the bad things/habits/life lessons you have learned from your father?,1.0,2,0,False,3
596,What do you highly recommend to unlearn as you reach your 30s and why?,0.9,7,0,False,8
597,What is your alternative dessert after they found ice cream tests positive for coronavirus in China?,0.8,3,0,False,11
598,Which relatively minor character are you unreasonably attached to?,1.0,3,0,False,5
599,What is something that the population should be more educated about?,0.75,4,0,False,15
600,What's the most messed-up thing you've ever heard of happening to a family?,1.0,5,0,False,11
601,"When you can't sleep, what tricks up your selve do you do to help you sleep?",1.0,5,0,False,35
602,What is an expensive item that is worth the cost?,1.0,6,0,False,22
603,"People that work in that place where monkeys shit out coffee beans and you collect them, how's it going?",1.0,2,0,False,2
604,What gender are you and do you believe in “being just friends” ?,0.74,4,0,False,28
605,"What’s a word you know the meaning to, but can’t explain because you just expect everyone to already know what it means?",1.0,6,0,False,11
606,People who have been on/worked with reality tv: what‘s something bizarre that goes on behind the scenes?,1.0,5,0,False,5
607,"You have won the greatest lottery, but instead of money you get to choose what Elon Musk will engrave on the moon, to be visible by everyone, what do you chose?",1.0,2,0,False,6
608,"You are able to make evolutionary changes that take millions of years, to happen overnight. What would you add or take away to design a more perfect human?",0.75,2,0,False,2
609,"People of Reddit, what was the most awkward thing you saw when entering a classroom?",1.0,2,0,False,0
610,"[SERIOUS] Former alcoholics/addicts of reddit, when did you realize it was a problem, what made you stop and how are you doing now?",0.8,3,0,False,10
611,"We all know that curiosity killed the cat, but when did it come closest to killing you?",0.83,4,0,False,10
612,What turn off made you stop having a crush on someone?,1.0,9,0,False,38
613,"If you could create your own utopia, what would you include?",0.88,6,0,True,14
614,What are some non-obvious signs that someone is not a good person?,0.67,2,0,False,11
615,If 2020 had game/movie titles what would it be called?,0.64,4,0,False,11
616,What's the worst reaction you've gotten about your penis size?,0.83,7,0,True,21
617,Why are you horny right now and what are you going to do about it?,0.7,4,0,True,40
618,"Which black and white movie, If you had to choice would best sum up earth and it's population?",0.86,5,0,False,18
619,"People with chronic medical conditions, what is some advice that you would you give to someone newly diagnosed with your condition?",0.83,4,0,False,4
620,What is an experience you had that made you rethink your life?,1.0,2,0,False,2
621,"Non-Americans of Reddit, what is the alternative name for Karens in your home country?",0.75,2,0,False,10
622,What are some food combinations that seem bad but are actually good?,1.0,2,0,False,14
623,What is the least helpfully advice?,0.75,2,0,False,10
624,When was the last time you broke someone’s heart?,1.0,2,0,False,4
625,What's an awful scene from an otherwise perfect movie?,0.87,6,0,False,4
626,"For the Redditors who have lived/are living outside of the US, as a nation how do we look in your eyes?",0.75,2,0,False,8
627,"If you could choose to do anything for a day, what would it be?",1.0,5,0,False,17
628,What’s the weirdest dream you had that significantly changed your life or the way you look at life/death ?,0.81,6,0,False,5
629,What are some laws/rules designed to “protect” us but really protect large businesses?,1.0,5,0,False,3
630,"To those who struggle with paranoia, what are ways you have found to ground yourself and find safety in your mind when triggered?",0.86,5,0,False,5
631,"You can chose any job you like but you will get paid bare minimum wage, what job would you chose?",0.82,24,0,False,63
632,"People who continue to misspell words, like ""recieve"" and ""wierd"", even after spell check tells you it's wrong, why do you do it?",0.79,13,0,False,48
633,You have 10 minutes to live. What do you do?,1.0,9,0,False,22
634,How did you earn your “certified dumbass” status?,0.92,10,0,False,14
635,"What would you do if every year all of your teeth fall out and a new set grow back, similar to a snake shedding it’s skin?",0.72,3,0,False,12
636,Have you ever accidentally met someone on Reddit that you actually knew personally? What was it like?,1.0,5,0,False,11
637,Best answer wins. Why aren’t dinosaurs in the bible?,0.63,4,0,False,66
638,What's your favorite American accent?,0.75,2,0,False,11
639,How did you consistently workout and not give up?,1.0,7,0,False,20
640,What’s the craziest thing you’ve ever witnessed?,0.86,5,0,False,10
641,What’s a scary animal encounter you’ve had?,1.0,5,0,False,26
642,"What is boring, but MUST be done?",0.83,4,0,False,20
643,"If you could replace one actor from any movie with Nicolas Cage, who would it be and why?",0.86,5,0,False,21
644,What video game have you put the most hours into?,1.0,11,0,False,54
645,How did you discover the ugly truths of your dream career field?,0.83,4,0,False,12
646,What is the most concerning thing about your body that you haven’t gotten fixed?,0.87,21,0,False,64
647,People who have a disorder; what is something that people just don't seem to understand about your disorder? (SERIOUS),0.75,2,0,False,7
648,"Ex-bullies of Reddit, what made you change your ways?",1.0,5,0,False,0
649,Whats the worst advice you could give someone?,0.75,2,0,False,15
650,"Redditors who have tried dating your boss, how did it go?",1.0,5,0,False,9
651,What movie/tv show/film broke you down emotionally?,0.8,6,0,False,21
652,"What is your favorite documentary, and why?",1.0,9,0,False,20
653,What would you do when you've been betrayed by someone you trust?,1.0,3,0,False,8
654,Serious what is a good brand of over the counter cough medicine?,0.6,1,0,False,2
655,You are assigned to make a poster that will motivate humans in the toughest times. What will you add in that poster?,1.0,2,0,False,8
656,Why do you hate pineapple on pizza?,0.57,1,0,False,17
657,Whats the most disturbing thing you've ever seen ?,1.0,7,0,False,23
658,How do you know you’ve fallen out of love with someone?,0.75,2,0,False,9
659,Why be toxic in a video game?,0.83,4,0,False,10
660,Whats is something that you hate but can't stop doing?,0.9,7,0,False,21
661,"Those who say ""what's the worst that could happen?"" or ""how bad can it be?"" What's the worst thing that happened after you said it?",1.0,8,0,False,5
662,"Vegan people of Reddit, what is your opinion on vegan food that looks like meat ?",0.67,1,0,False,2
663,"people who do autopsies, what is the scariest thing you've seen or experienced ?",0.84,4,0,False,3
664,People who work with dogs professionally: Who was the dumbest dog you've ever had the privilege to meet?,0.96,3344,0,False,973
665,What little steps can one take when young to be healthy later in life?,1.0,3,0,False,6
666,How does one fix their sleeping pattern ONCE and for FUCKING ALL?,1.0,10,0,False,15
667,What food is only good with cheese?,0.75,2,0,False,10
668,What are some things people say in movies/TV shows that people never say in real life?,1.0,3,0,False,7
669,What’s the most amazing thing the human body can do?,1.0,3,0,False,14
670,What sexual fantasy or act did you do that turned out to be overrated and why?,0.82,7,0,True,29
671,"If you won $100 million dollars tomorrow, what's the first thing you would either do or buy with it?",0.6,2,0,False,38
672,"People who have gotten one or more of their coworkers fired, what happened? What was the fallout?",1.0,2,0,False,2
673,What is the best superpower?,0.6,1,0,False,12
674,How can we let go of the obsession with a person?,0.75,2,0,False,3
675,What do you think about Barstool Sports being one of the only companies supporting small business during these lockdowns?,0.75,2,0,False,5
676,What is better than pizza?,0.78,12,0,False,85
677,What's the worst subreddit on reddit?,0.84,4,0,False,18
678,what do you love about Reddit?,0.75,2,0,False,8
679,What is something that has been ruined for you forever?,0.84,4,0,False,24
680,How much money do you need and why?,0.82,20,0,False,129
681,What are you terribly bad at?,0.99,12,0,False,43
682,"People with step-parents who now consider them as their real parents, what was the defining moment that made you change your mind?",1.0,6,0,False,1
683,[SERIOUS] What was the best ending to the best date ever?,1.0,4,0,False,3
684,How did your childhood abuse change you?,1.0,3,0,False,14
685,Who is the most famous person you personally know?,0.84,4,0,False,15
686,"People who live right at the boarder of a time zone, how does this impact day to day life?",0.8,3,0,False,4
687,You are required to become a nuisance. What do you do?,0.82,7,0,False,14
688,How do you deal with being lonely?,1.0,3,0,False,13
689,How did you come to terms with death?,1.0,3,0,False,20
690,Whats the weirdest thing a teacher has done in class?,1.0,3,0,False,7
691,"If you could have a 5-minute conversation with your future self or past self, which would you choose and why?",1.0,3,0,False,20
692,What don't you understand right now?,1.0,2,0,False,16
693,What are some good Scholarships for juniors?,1.0,3,0,False,2
694,What are your 2021 resolutions?,1.0,2,0,False,6
695,What's your favourite sub that never makes it to the front page?,1.0,3,0,False,6
696,"If Reddit got reset and all the sub-reddits you followed got cleared, which sub-reddit would you most probably forget to follow again?",1.0,2,0,False,1
697,Masochist of reddit what kind pain or humiliation do you not enjoy?,1.0,2,0,False,1
698,What country are you in right now?,1.0,2,0,False,20
699,What is your craziest family story?,1.0,3,0,False,3
700,What can you do when your girlfriend/boyfriend wants more conversation?,0.67,4,0,False,30
701,"Divorced people: when you look back on it, were the outlines of the problems that ended your marriage visible from the very beginning?",0.67,3,0,False,5
702,"Women of reddit, do you also get 'horny singles in your area' ads, if not, what are your standard adverts?",0.84,40913,1,True,4416
703,"What are the underrated sub reddits, that u know ?",0.67,2,0,False,6
704,Once facemasks are no longer mandatory in any setting should companies enact policies that those sick should wear a facemask? What are the positives and negatives?,0.75,2,0,False,13
705,how has COVID-19 changed you?,1.0,3,0,False,14
706,Who are the most influential Reddit users of 2020/2021?,0.75,2,0,False,8
707,what is your idea of a first date?,0.87,6,0,False,23
708,"people who are rude to wait staff, why are you such an asshole?",0.8,6,0,False,13
709,What is the best way to flirt with others?,0.8,3,0,False,11
710,What's the best looking flag from fiction?,1.0,4,0,False,2
711,If you got a chance to erase one memory what would you erase and why?,1.0,2,0,False,5
712,What was the worst shock video you seen online and why?,0.75,2,0,True,18
713,What is the most annoying thing about linkedin?,1.0,5,0,True,12
714,"If you could choose to live in any type of home for the rest of your life (loft, apt, house, mansion, condo, etc.) what would it be and why?",1.0,5,0,False,13
715,What is the craziest accidental text you have received? Or what is the craziest text you accidentally sent someone?,0.84,4,0,False,7
716,What question have you been waiting to be posted and how would you answer it yourself?,0.75,2,0,False,1
717,What IS a fun fact?,0.83,4,0,False,10
718,"If you could add one feature to the English Language, what would it be?",1.0,5,0,False,14
719,People of reddit what is the best pick up line you've ever heard or made up?,0.67,2,0,False,13
720,What is one thing you want to do differently in life compared to your parents?,1.0,4,0,False,19
721,What's your favorite video game series?,0.75,2,0,False,20
722,What city or location has the best architecture for a zombie or apocalypse style video game in the future if the location was 100% accurate?,1.0,3,0,False,5
723,"Is there only one universe, why or why not?",1.0,4,0,False,6
724,What reasons cause humble people to be so rare?,1.0,2,0,False,6
725,"People who succeeded in math, have you ever used it in your life?",1.0,8,0,False,18
726,"Doctors of reddit, why do our feet gets cold even if we're under the blanket? And how would you prevent that?",1.0,5,0,False,21
727,What's the weirdest thing you've witnessed at an airport?,1.0,3,0,False,12
728,If you could be one humans left nipple for a day who would it be?,0.67,3,0,False,7
729,What is the hardest or rarest achievement you’ve gotten in a video game?,1.0,4,0,False,6
730,"Which is gloomier, France or England?",1.0,3,0,False,11
731,What was your first word?,0.84,4,0,False,16
732,"Teachers of reddit, what did a kid do to make you go, ""You really weren't as smart as I thought you were.""?",1.0,2,0,False,0
733,"The Beatles were the voice of Baby Boomers, Kurt Cobain was the voice of Gen X, who is the voice of Gen Z?",0.75,2,0,False,19
734,What's the most f*cked up thing that will forever live in your head?,0.75,2,0,False,16
735,"Those who feel lonely and socially isolated and feel like they don't have anybody to talk to, how did you end up in this situation and how are you coping?",0.6,2,0,False,7
736,What’s something you can’t wait to go out of style?,1.0,4,0,False,13
737,When you hear the phrase “ missed opportunity” what’s the one thing that comes to mind?,0.85,16,0,False,29
738,Why did you cover the camera on your laptop?,1.0,2,0,False,13
739,"What's a sentence that's considered perfectly normal in a specific context, but would sound crazy anywhere else?",1.0,2,0,False,7
740,"Creatives of Reddit, how did your support system (parents, friends, loved ones, etc) react about your creative endeavors, at first, and how do they react to it now?",1.0,2,0,False,4
741,Self-taught drummers of reddit. How the hell did you do it?,1.0,2,0,False,3
742,Who is the most arrogant TV character of all time?,0.8,3,0,False,5
743,What is your favorite thing to do while drunk ?,1.0,4,0,False,19
744,What are some cool (or unsettling) facts about the universe?,1.0,4,0,False,12
745,"If porn had commercials, what would they be for?",0.72,3,0,True,16
746,If you could only listen to 1 song for the rest of your life what would it be?,1.0,3,0,False,13
747,What is a hard life lesson you wish they’d taught you in school?,1.0,3,0,False,2
748,What was the wildest dream/nightmare you had that you still remember to this day?,1.0,4,0,False,8
749,What’s the easiest skill to learn in under 10 minutes?,1.0,4,0,False,22
750,What’s something or someone you regret introducing to another person?,0.84,4,0,False,4
751,What’s the worst thing you have ever seen on the internet?,0.86,5,0,True,31
752,What do you think reddit will be like in 10 years?,0.75,2,0,False,15
753,What is the first movie you remember seeing?,0.87,27,0,False,69
754,Why comment with out voting?,0.6,2,0,False,10
755,What can't you believe hasn't been invented yet?,1.0,4,0,False,14
756,What’s a piece of useless information that actually came in handy?,1.0,2,0,False,6
757,"We always ask about not so fun facts, but what are some fun facts?",0.7,4,0,False,26
758,What's the dumbest reason you've hated someone for?,1.0,3,0,False,15
759,What piece of evidence made you think that an extraterrestrial intelligence might have visited Earth?,1.0,2,0,False,14
760,"Your best friend comes and tells you ""I'm going to have to go to prison for drug possession and distribution. I had a little cocaine and I sold some to my friend."" How often do you plan to visit them in prison? Do you plan to write to them or call them?",0.8,3,0,False,7
761,"[Serious] Those who are the minority of the country they live in (race, ethnicity etc), what discrimination and problems do you face from being a minority?",0.75,2,0,False,9
762,What do you think about Oumuamua? [Serious],1.0,3,0,False,7
763,If you could learn one instrument what would it be?,1.0,3,0,False,21
764,What books were assigned reading in middle and high school for you?,1.0,3,0,False,13
765,Whats the worst alternate game title you can think of for your favourite game?,1.0,3,0,False,10
766,What was the funniest thing you've ever heard in a game chat lobby playing a multiplayer video game?,1.0,5,0,False,6
767,How do you pronounce Chocobo? Like chocolate? Or like choke-o-bo?,0.84,4,0,False,4
768,"What can you get away with in your 20s, but not later in life?",1.0,3,0,False,7
769,"To all of the people in Reddit, what was your favorite soundtrack in a Videogame?",1.0,3,0,False,21
770,What did you do for your 18th/21st birthday?,1.0,4,0,False,19
771,"What are some moments in your life you want to turn back time and fix very, very badly?",1.0,3,0,False,22
772,What was the initial ritual you had to go through in life?,0.8,3,0,False,3
773,What is a horror movie that is genuinely scary that isn’t very old?,0.81,3,0,False,24
774,Any tips for how to forgive yourself for past mistakes?,1.0,2,0,False,6
775,When did you realize you were not the smartest one in the pack?,1.0,2,0,False,8
776,Would you give up 7 years from your life for the ability to choose how you are going to die?,0.67,2,0,False,14
777,What thought keeps you up most at night when you are trying to sleep?,1.0,5,0,False,12
778,If someone says ‘Can you believe we’re still talking about this shit?’ What is ‘this shit’ in your opinion?,0.78,5,0,True,25
779,What apps did you purchase that are well worth the money?,1.0,3,0,False,9
780,What is your opinion of Steven Stiffler from the American Pie series?,1.0,3,0,True,5
781,How does one acquire the art of not giving a fuck?,0.83,4,0,False,27
782,What’s something that took you a long time to admit to yourself?,1.0,2,0,False,10
783,If you had one more day alive what would you do?,1.0,6,0,False,18
784,Why did you “Come out” on the internet?,0.84,4,0,False,10
785,If Michael Scott was played by someone other than Steve Carell who would it be and why?,0.78,5,0,False,10
786,What was creepiest thing you saw while camping?,1.0,2,0,False,4
787,How would you describe yourself using only 3 songs?,1.0,3,0,False,10
788,What was the worst thing said to you?,0.75,2,0,False,20
789,"You can haunt someone when you die, but it can't be someone you know personally. Who do you haunt and why?",1.0,3,0,False,11
790,What are you grateful for?,1.0,6,0,False,6
791,Which fictional universe has the best food?,1.0,4,0,False,14
792,How did you meet your significant other?,0.64,3,0,False,18
793,What are your tips on being more likeable and confident?,1.0,3,0,False,8
794,How would you feel if a girl randomly asked you to cuddle?,0.62,3,0,False,30
795,What are some common spelling mistakes that really annoy you?,0.8,3,0,False,14
796,What is your favourite painting?,1.0,2,0,False,6
797,What is the most obscure kitchen utensil?,0.84,8,0,False,16
798,"If you wanted to change a climax/ending of a movie, which one it would be ?",1.0,3,0,False,5
799,What would you say to a struggling teen right now?,1.0,2,0,False,16
800,"What is a random, but also terrifying science fact that not enough people know?",1.0,2,0,False,2
801,"What's something good to eat late at night that's filling, quiet, and easily accessible?",1.0,3,0,False,22
802,What’s something you made popular in your group of friends\community?,1.0,5,0,False,7
803,What accents better UK or USA?,1.0,3,0,False,25
804,What to do when the rolaids and tums stop working as well (Acid)?,1.0,3,0,False,7
805,What is a song you can recite beat for beat from beginning to end without many mistakes?,0.72,3,0,False,15
806,"With all that is going on right now, what are some good things going on that restore faith in humanity ?",1.0,4,0,False,4
807,What was the stupidest dare you completed?,1.0,8,0,False,9
808,What life lesson from a tv show or movie has stuck with you?,1.0,2,0,False,10
809,"What made you think ""I've still got it"" ?",1.0,2,0,False,5
810,How do you tell your brain to shut up sometimes?,0.86,5,0,False,14
811,Welcome to the first international Hunger Games. Two citizens from each country are to participate. What country wins?,0.72,3,0,False,19
812,What opinion did you hold that you're proud to have changed?,1.0,2,0,False,7
813,What’s been your biggest disappointment?,1.0,3,0,False,9
814,How do you small talk?,0.75,2,0,False,15
815,What’s your most awkward moment in a parent/teacher or student/teacher conference?,1.0,4,0,False,2
816,What's the best piece of advice a friend has given you?,1.0,4,0,False,10
817,What is the weirdest position you woke up at?,1.0,3,0,False,11
818,What’s your biggest accomplishment so far?,0.9,27,0,False,45
819,What makes someone attractive?,1.0,9,0,False,25
820,"People who are Search and Rescue officers, how did you get the job, and what requirements are needed?",1.0,2,0,False,1
821,Okay so you doing your thing and then suddenly you see Quailman walk up to you. What you gonna do?,1.0,2,0,False,6
822,What’s your “5 Seconds of Fame” story? Are you still recognized today because of it?,0.8,3,0,False,4
823,Where are you now?,1.0,2,0,False,33
824,"Pilots of Reddit, what is the strangest or scariest thing you’ve experienced while in the air?",1.0,8,0,False,6
825,How did you get those SCARS?,0.8,3,0,False,35
826,"(serious) Since ""Video Killed the Radio Star"" from the old song title. What killed the Video Jockeys?",0.83,4,0,False,8
827,What show has the best intro/opening credits?,1.0,6,0,False,25
828,"[Serious] People of Reddit, what decision did you make that changed your life forever?",0.86,5,0,False,18
829,Which subreddit do you genuinely hate the most?,0.91,8,0,False,21
830,Why can you not visit the North Pole?,0.75,2,0,False,16
831,What is weirdest nickname you were given by your family?,0.8,3,0,False,21
832,What’s the oldest and most famous meme or viral video that you only recently discovered for the first time?,1.0,3,0,False,3
833,What's the most insane actual rich person behaviour that you've experienced?,1.0,4,0,False,6
