,Title,Upvote_ratio,Score,Gilded,Over_18,Number_of_Comments
834,"If you could create a reality TV show that’s like nothing we’ve seen before, what would you make?",1.0,2,0,False,14
835,[Serious] What did you give up to get where you are now?,0.83,4,0,False,21
836,What would happen if Kirby ate a Ditto?,0.82,11,0,False,16
837,"Reddit, what’s advice you wish you knew when you first started your dating life?",0.83,4,0,False,11
838,"Those who have lived through a plane crash landing, or know some one who has, what was the experience like?",1.0,6,0,False,5
839,When did your dog save you from an intruder?,1.0,6,0,False,5
840,What's the weirdest thing you've seen at school?,0.81,3,0,False,9
841,Who is your hero?,1.0,5,0,False,9
842,What's the most f**ked up thing you ever saw happen in a locker room?,0.86,5,0,True,12
843,"Who’s your favorite singer, and why?",1.0,2,0,False,14
844,"People of Reddit, what is the worst haircut you have ever had?",0.83,4,0,False,13
845,"What is the longest grudge you've held, and why?",1.0,3,0,False,6
846,What instance did you agree with your enemy?,0.75,2,0,False,4
847,Which celebrity would you want as your other BFF and why?,1.0,3,0,False,9
848,"People who have student loans, what's your plan of repaying and how much have you repaid? [Serious]",1.0,3,0,False,14
849,"What was a fucked up thing that happened to you, that you didn't realise was fucked up till years later?",1.0,4,0,False,10
850,What would you do if you permanently switched to the opposite sex?,0.79,21,0,True,93
851,What's the worst idea you have heard?,1.0,3,0,False,8
852,"If you could become the worlds greatest on an instrument, what instrument would that be?",0.9,7,0,False,19
853,Which song fills you with joy everytime you hear it?,0.87,6,0,False,23
854,"When did you realize “Oh, I’m totally getting fired.”?",1.0,6,0,False,6
855,"Creatives of Reddit, what’s the creation that you feel in your very soul? The one that everything you do is working towards?",1.0,2,0,False,1
856,"[SERIOUS] People whose parents ""went to get milk"" what did you do when they disappeared?",0.88,6,0,False,5
857,"Dear surgeons of reddit, what's the strangest thing you've removed from a patient's body?",1.0,3,0,False,1
858,What separates gamers from epic gamers?,0.56,1,0,False,11
859,What do you think will be illegal in 100 years that is perfectly legal now?,0.65,4,0,False,24
860,"Women of Reddit, what are some SFW things you say that allude to meaning something NSFW?",0.75,2,0,True,1
861,What meal is terrible as leftovers?,0.83,4,0,False,34
862,What is the most impressive hack you know about anything?,1.0,3,0,False,5
863,[Serious] How does one delete/get rid of followers on Reddit?,0.75,2,0,False,13
864,How are electric vehicle batteries recycled?,1.0,2,0,False,9
865,[Serious] How do someone survive with Asian parents?,0.63,2,0,False,15
866,Why are you unhappy? (Serious),1.0,3,0,False,28
867,What’s the meanest thing someone has said to you ?,1.0,3,0,False,4
868,What's the most annoying thing you do to yourself?,0.87,17,0,False,43
869,What's order do you dry each body part after a shower?,1.0,3,0,False,12
870,"Redditors of reddit who have already read it, what made you delete your last account?",0.63,2,0,False,7
871,"If you were sent back in time into your 5 year old self without losing any knowledge or memories, what would be your plan for that second chance at life?",0.9,7,0,False,15
872,How often do you have little hallucinations like seeing things out of the corner of your eyes or hearing your name?,1.0,3,0,False,8
873,"What would you say to your past self, 10 years ago if you could?",0.75,4,0,False,19
874,"Who's a musician that you kinda hated at first, but then changed your mind later on and kinda fell in love with?",0.8,3,0,False,13
875,What’s a movie that bombed at the box office and has negative reviews that you secretly love?,1.0,2,0,False,10
876,Your username is related to why you got arrested. What was your crime?,0.76,90,0,False,508
877,"If you can bring an invention from the present to a specific time period from the past, what would it be?",1.0,2,0,False,4
878,"People who started college in their twenties, how did you proceed and how’s it presently?",1.0,5,0,False,3
879,"Soldiers, how does having women in a unit change how the men act?",0.8,3,0,False,8
880,"People who dye their hair to hide the gray, why?",1.0,3,0,False,17
881,"Your child asks about the internet, what's the first thing you tell/show them?",0.86,5,0,False,20
882,How is 2021 treating ya?,0.72,3,0,False,19
883,"Suicide prevention hotline workers, what's your creepiest story? (Serious)",0.81,3,0,False,0
884,"All sport mascots have come to life and are eligible players, which teams are getting a win and which are taking the loss?",0.86,5,0,False,7
885,Have you ever been embarrassed by a teacher in class? If so what happened?,1.0,7,0,False,17
886,People who like exercise - why?,0.83,33,0,False,62
887,"Skinny/Thin Men of Reddit: how do you handle when told ""you’re so skinny?""",1.0,5,0,False,10
888,You are due to have a battle. The opponent? The thing in the last photo that you took. How screwed are you?,1.0,4,0,False,39
889,"What is your opinion of 2021 so far, Is it gonna be better than 2020?",0.86,5,0,False,11
890,Which fictional character feels eerily realistic?,0.75,2,0,False,6
891,What is the most creative way you got Rickrolled?,0.78,5,0,False,8
892,"What's something someone said to you that you thought was nice, but later realized wasn't?",1.0,3,0,False,0
893,[SERIOUS] How can someone be more confident?,1.0,6,0,False,14
894,What is something petty that you can't help but be jealous of?,1.0,3,0,False,10
895,When was the last time you danced?,0.67,2,0,False,36
896,when did you decide that you needed to change to get farther in life?,1.0,3,0,False,2
897,What is the best way to destress?,0.81,3,0,False,13
898,What’s your favorite Disney channel original movie?,1.0,3,0,False,6
899,What are your biggest earnings or losses in life?,1.0,3,0,False,3
900,Artists of reddit how do you earn money online? Any advice or experience to share about it?,0.72,3,0,False,1
901,"If you were given $100,000 right now, tax free, what would you do with it?",1.0,4,0,False,29
902,What’s the sexiest nationality?,0.64,3,0,False,42
903,"We often think of animals having one sound, such as meow, what sound would that be for humans and why?",0.89,7,0,False,14
904,How do you post pictures on reddit without them turning into links?,0.63,2,0,False,1
905,"[Serious] If today's military tacticians were to plan the invasion of Normandy today, how would they do it? And how would it compare to the actual invasion plan from WW2?",0.83,4,0,False,32
906,"In your opinion, where is the line between insanity and creativity and why do you think so?",1.0,3,0,False,7
907,How do you know someone is a fake friend or someone isn’t your friend?,1.0,7,0,False,7
908,What’s the most British tv show?,1.0,6,0,False,33
909,"if you could play any instrument, what song would you learn first?",0.75,2,0,False,15
910,How would you describe the USA to someone who has never heard of it?,0.67,2,0,False,18
911,"[Serious] Former extremists of Reddit, how did you come to that position, and how did you get out of it?",0.86,5,0,False,2
912,What’s a mutually accepted superstition where you work?,1.0,5,0,False,13
913,What's your favourite not well-known fact?,0.84,4,0,False,32
914,"People of Reddit, what have you realized now during quarantine that you really took for granted or hated before that you want back?",0.67,3,0,False,13
915,What toxic trait or red flag are you inexplicably attracted/drawn to?,1.0,6,0,False,9
916,What's the strangest thing you've seen happen in an airport or on a plane?,1.0,3,0,False,19
917,What are some of the downsides of moving to New Zealand from America?,0.67,2,0,False,12
918,What is the worst thing a relative ever said to you or to someone in the room?,1.0,3,0,False,6
919,"Lottery Winners of Reddit, how much did you win and how did that change your life?",1.0,4,0,False,5
920,What are some of the best working scams out there?,1.0,3,0,False,4
921,Which two subs on your list look weird/out of place next to each other?,1.0,2,0,False,0
922,What’s the strangest thing you’re allergic to?,1.0,4,0,False,13
923,"If America was created in your image, what would it look like?",1.0,3,0,False,12
924,What was that one weird kid at school known for?,0.75,4,0,False,16
925,"People of reddit, what is the most attractive thing a person of the same sex has done around or to you that made you consider/discover being homosexual?",0.71,3,0,True,7
926,When was the last time you felt like your dick was going to fall off?,0.75,2,0,False,5
927,whats the hardest question to answer?,0.8,3,0,False,16
928,What happens when a controlled demolition doesn't bring the building down all the way?,0.75,2,0,False,7
929,Where will you travel to once COVID-19 is behind us?,0.75,2,0,False,9
930,What are some good tips and tricks to getting started with Music Production in Ableton Live?,1.0,2,0,False,3
931,What is something that you appreciate a lot that people don’t realise means so much?,1.0,2,0,False,18
932,How did you achieve your fastest intentional weight loss?,1.0,2,0,False,16
933,"AskReddit, What childhood memory was fun at the time but has later been revealed to have been really disturbing?",0.81,3,0,False,2
934,Who would you challenge to duel if you could?,0.84,4,0,False,11
935,What’s one of your weirdest intrusive thoughts?,1.0,3,0,False,6
936,What were or was the weirdest dream(s) you had that you for some reason still remember?,1.0,3,0,False,5
937,"if you could go back in time and kill any person in history, who would it be and why?",1.0,6,0,False,16
938,What's better Spotify or youtube when you are listening to music?,1.0,3,0,False,15
939,Kirby just inhaled you. What power does he get?,0.68,6,0,False,35
940,What's your wierd hobby?,0.83,4,0,False,13
941,"Seattleites of Reddit, how’s life?",1.0,2,0,False,1
942,Where do you leave your shoes?,0.88,6,0,False,9
943,What do you consider the perfect nap?,1.0,5,0,False,14
944,"New Yorkers of Reddit, how’s life?",1.0,2,0,False,2
945,What is the reason behind the decrease in new serial killers?,0.83,4,0,False,28
946,"Redditors, what is your favorite Men Without Hats/ Men At Work songs?",1.0,4,0,False,8
947,"Model Makers of Reddit, what was your most expensive kit and how long did it take for you to build? How’d it turn out?",1.0,3,0,False,0
948,What is your multi-tasking gone wrong story?,1.0,2,0,False,1
949,Which famous person would look funniest as a giant smashing a city apart 'God-zilla' style?,0.87,6,0,False,23
950,What's the biggest crime against food you've seen?,1.0,5,0,False,15
951,What is one moment you shouldn't have gotten out of but did because of dumb luck or quick thinking?,1.0,3,0,False,1
952,What’s your first ever memory?,0.82,10,0,False,25
953,"We know about scary ""urban exploration gone wrong"" stories, but what about wholesome ""urban exploration gone right"" stories?",0.75,2,0,False,2
954,If you lived in the game you have the most playtime in for three years in playtime not in-game time as the protagonist and got to keep the loot what would be the results both during and after?,1.0,4,0,False,4
955,"Parents who gave their child up for adoption, what does it feel like to have your child reach out to you after the fact, as in after they have been adopted / raised by another family?",1.0,3,0,False,1
956,Is this the timeline where the infinity stones didn’t get put back?,0.73,5,0,False,8
957,What do you silently judge people for?,0.86,74,0,False,324
958,What's your favorite comeback for when someone tells you to quit an online game?,1.0,7,0,False,16
959,"What are two things that seem very unrelated at surface level, but are surprisingly super connected?",0.8,3,0,False,16
960,What Marvel dude/dudette would you be if you had to choose?,0.86,5,0,False,14
961,What concert melted your face?,0.83,4,0,False,25
962,"Adults, how has your stance on an issue changed due to you being aged?",0.86,5,0,False,13
963,"Janitors of reddit, what was the worst thing you ever had to clean up?",0.9,7,0,True,19
964,"What's your best ""fuck this shit, I'm out"" story?",0.76,4,0,False,6
965,"People who've been in the audience of a live talk show, what really happens during a commercial break?",0.75,2,0,False,5
966,What valuable lessons should we learn from history?,1.0,6,0,False,4
967,Replace the soundtrack to your favorite movie with Weird Al parodies. How does it change the movie?,0.75,2,0,False,3
968,You wake up one day to discover you have a cult of people who will do whatever you say without question. What is the first thing you do with your newfound power?,1.0,5,0,False,14
969,If you could bring one type of extinct animal back to life. What animal would want it be and why?,1.0,5,0,False,7
970,What screams “Im way richer than I look?”,0.93,775,0,False,992
971,"People who eat meat: if meat was perfectly replicated in a lab and budget friendly, would you still eat animals?",0.79,11,0,False,55
972,What sort of games/activities would Death play or do to relax from how depressing their job is?,1.0,6,0,False,3
973,What's a fun fact about yourself?,1.0,6,0,False,33
974,why do you buy /not buy apple products?,0.99,7,0,False,26
975,What’s the strangest thing you have seen in public?,0.71,3,0,False,10
976,"Any Underground songs you'd like to share that you never had a chance to, whats the story behind your discovery?",0.67,3,0,False,6
977,"Guys of Reddit who first met their girlfriends glammed out with sexy makeup and hair, how was it the first time you saw them just natural?",0.71,3,0,True,9
978,What is your proudest fap?,0.83,4,0,False,4
979,What are you planning on dreaming tonight?,0.72,3,0,False,23
980,What's the worst way you've heard your name pronounced?,0.78,12,0,False,34
981,"What language other than English are you fluent in? If none, then what language do you wish to learn?",1.0,3,0,False,11
982,What movie character nailed your personality?,0.84,4,0,False,13
983,What is the longest paper you had to write in college/ university/ highschool?,0.82,12,0,False,26
984,What would be your last meal if you were to be executed?,0.87,10,0,False,44
985,What movie did you hate that you feel everyone else enjoyed?,1.0,2,0,False,15
986,What's an important life lesson you've learnt?,0.93,24,0,False,61
987,What are some good American jokes that Europeans can't understand?,1.0,3,0,False,7
988,"Earth joins an alien union and chocolate is revealed to be an extremely deadly poison or dangerous addictive drug for every other alien species but humans, how does this affect earth and chocolate industry on earth?",0.67,3,0,False,9
989,In what situations have you wanted someone to be there for moral support?,1.0,3,0,False,6
990,"Dear people of Reddit, what do you order at Subway?",0.81,10,0,False,81
991,Women of Reddit! What the best advice for when you're on your period?,0.7,4,0,False,28
992,"You walk down the London roads, and out of nowhere, unexpectedly, someone says Hello. What will you do?",0.6,2,0,False,13
993,What would have been the equivalent of your job 100 years ago?,1.0,3,0,False,16
